{
  "schema_version": "1.0",
  "id": "document.economydesign",
  "version": 1,
  "type": "EconomyDesign",
  "language": "en",
  "status": "draft",
  "sources": [],
  "links": [],
  "history": [
    "Template; replace with project-specific revision history."
  ],
  "body": "## Economy design\n\nResources; sources/sinks; exchange; constraints; seed and model; violation witnesses.\n\nClaim status: DESIGN_HYPOTHESIS until tested. Include evidence, assumptions, alternatives and validation_method. Do not invent results."
}
