{
  "schema_version": "1.0",
  "id": "document.riskregister",
  "version": 1,
  "type": "RiskRegister",
  "language": "ru",
  "status": "draft",
  "sources": [],
  "links": [],
  "history": [
    "Template; replace with project-specific revision history."
  ],
  "body": "## Риски\n\nДля каждого риска: основание; неопределённость; последствия; владелец; эксперимент снижения риска.\n\nСтатус утверждений: DESIGN_HYPOTHESIS до проверки. Укажите evidence, assumptions, alternatives, validation_method. Не вставляйте вымышленные результаты."
}
