{
  "schema_version": "1.0",
  "id": "document.technicalconstraints",
  "version": 1,
  "type": "TechnicalConstraints",
  "language": "en",
  "status": "draft",
  "sources": [],
  "links": [],
  "history": [
    "Template; replace with project-specific revision history."
  ],
  "body": "## Technical constraints\n\nPlatform; budget; measurement sources; acceptable tradeoffs; compliance checks.\n\nClaim status: DESIGN_HYPOTHESIS until tested. Include evidence, assumptions, alternatives and validation_method. Do not invent results."
}
