{
  "schema_version": "1.0",
  "id": "document.decisionrecord",
  "version": 1,
  "type": "DecisionRecord",
  "language": "en",
  "status": "draft",
  "sources": [],
  "links": [],
  "history": [
    "Template; replace with project-specific revision history."
  ],
  "body": "## Decision record\n\nProblem; context; alternatives; chosen solution; consequences; revisit conditions. Approval is separate.\n\nClaim status: DESIGN_HYPOTHESIS until tested. Include evidence, assumptions, alternatives and validation_method. Do not invent results."
}
