{
  "schema_version": "1.0",
  "id": "document.highconcept",
  "version": 1,
  "type": "HighConcept",
  "language": "en",
  "status": "draft",
  "sources": [],
  "links": [],
  "history": [
    "Template; replace with project-specific revision history."
  ],
  "body": "## High concept\n\nPlayer actions; distinctive possibility; smallest testable prototype.\n\nClaim status: DESIGN_HYPOTHESIS until tested. Include evidence, assumptions, alternatives and validation_method. Do not invent results."
}
