{
  "schema_version": "1.0",
  "id": "document.systemspecification",
  "version": 1,
  "type": "SystemSpecification",
  "language": "en",
  "status": "draft",
  "sources": [],
  "links": [],
  "history": [
    "Template; replace with project-specific revision history."
  ],
  "body": "## System specification\n\nInputs; states; transitions; outputs; dependencies; invariants; edge cases.\n\nClaim status: DESIGN_HYPOTHESIS until tested. Include evidence, assumptions, alternatives and validation_method. Do not invent results."
}
