{
  "schema_version": "1.0",
  "id": "document.coregameplayloop",
  "version": 1,
  "type": "CoreGameplayLoop",
  "language": "en",
  "status": "draft",
  "sources": [],
  "links": [],
  "history": [
    "Template; replace with project-specific revision history."
  ],
  "body": "## Core gameplay loop\n\nAction → rule → state → feedback → next decision.\n\nClaim status: DESIGN_HYPOTHESIS until tested. Include evidence, assumptions, alternatives and validation_method. Do not invent results."
}
