{
  "schema_version": "1.0",
  "id": "document.highconcept",
  "version": 1,
  "type": "HighConcept",
  "language": "ru",
  "status": "draft",
  "sources": [],
  "links": [],
  "history": [
    "Template; replace with project-specific revision history."
  ],
  "body": "## Высокая концепция\n\nДействия игрока; отличительная возможность; минимальный проверяемый прототип.\n\nСтатус утверждений: DESIGN_HYPOTHESIS до проверки. Укажите evidence, assumptions, alternatives, validation_method. Не вставляйте вымышленные результаты."
}
